State,County,Date,Raw Description,Information type,Mitigation type,Note,UserID,Source
Iowa,,3/30/2020,Reynolds also said today that the state will be getting this week at least 15 mobile testing units that can deliver results on COVID-19 tests within minutes.,other,new public service,,KS59,https://iowastartingline.com/iowa-covid-19-timeline/
Iowa,Polk,3/31/2020,The Polk County Health Department will change hours and services. We will NO longer be open until 7:00 PM on Tuesdays. Our hours will be Monday – Friday from 8:00 AM – 5:00 PM. Sexually Transmitted Diseases (STDs) testing by appointment only. We will no longer be doing express/walk in STD testing or urine drug screens.,government,public service reduction,,mm09,https://www.polkcountyiowa.gov/?page=1
Iowa,Polk,4/1/2020,"The large majority of Polk County services can be done online or by phone so please visit www.polkcountyiowa.gov to learn more. For the limited services that will be provided at Polk County locations all visitors will be screened for symptoms or possible exposure prior to entering the building (NOTE: this is not a COVID-19 diagnostic test, it is a non-invasive temperature check and health questionnaire). All visitors who can otherwise conduct their business online will not be allowed in the building.",government,public service reduction,,mm09,https://www.polkcountyiowa.gov/?page=1
Iowa,,4/1/2020,"Gov. Reynolds has encouraged social distancing and minimal public activity since the coronavirus took hold in Iowa, at today’s press conference her typical guidance to “stay home when you’re sick” became “essential errands only. Go out as little as possible, make sure that you’re going for groceries or medical — limit trips out and do them one at a time.”",other,stay at home,,KS59,https://iowastartingline.com/iowa-covid-19-timeline/
Iowa,,4/2/2020,"Today, Gov. Reynolds signed a new proclamation continuing the State Public Health Emergency Declaration. The proclamation orders the closure of schools, waiving time requirements as long as school districts put in place a continuous learning plan until April 30th. The proclamation also extends closures and limits placed on bars and restaurants previously identified retail stores, prohibits social gatherings of more than ten people, and continues to ban nonessential and elective surgeries until April 30th. And it extends and expands the previously granted regulatory relief and other measures until April 30th. Violating any of Governor Reynolds’ public health orders is a simple misdemeanor.",government,state of emergency,,mm09,https://governor.iowa.gov/press-release/gov-reynolds-signs-new-proclamation-continuing-state-public-health-emergency-2
Iowa,,4/2/2020,The recommendation to close K-12 schools also extends through April 30,other,school closing,extended to the end of April,KS59,https://iowastartingline.com/iowa-covid-19-timeline/
Iowa,Linn,4/6/2020,"To protect the health and safety of Linn County employees and the public, Linn County is extending the closure of most County facilities to the general public through April 30, 2020.",government,public service reduction,,mm09,https://www.linncounty.org/CivicAlerts.aspx
Iowa,,4/6/2020,"Reynolds broadened her order to close non-essential businesses to include: malls, social/fraternal clubs, bingo halls, bowling alleys, pool halls, arcades, amusement parks, libraries, museums, zoos, skating rinks/parks, outdoor/indoor playgrounds, tobacco/vaping stores, racetracks, toy/gaming/music/instrument/movie stores and campgrounds.",other,non-essential closing,broadened,KS59,https://iowastartingline.com/iowa-covid-19-timeline/
Iowa,Polk,4/7/2020,"he Polk County Medical Coordination Center encourages the public to follow the Centers for Disease Control and Prevention’s (CDC) guidance on wearing homemade face cloths in public settings such as the grocery store or pharmacy, where social distancing of 6 feet is difficult to maintain. The use of simple cloth face coverings reduces the spread of the virus and helps people who may have the virus and do not know it from transmitting it to others. Individuals need to continue to keep 6 feet between yourself and others when in public locations. The cloth face cover is not a substitute for social distancing.",government,wear masks,,mm09,https://www.polkcountyiowa.gov/?page=1
Iowa,Johnson,4/8/2020,"The Iowa City Farmers Market is postponing its opening until Saturday, June 6, 2020. The decision is based on information provided by the CDC regarding limiting social gatherings to no more than 10 people.",government,public service reduction,,mm09,https://www.icgov.org/news
Iowa,Johnson,4/10/2020,"the City is asking transit riders to please wear a cloth mask when riding a bus. Wearing a cloth mask while riding transit will help keep both the drivers and riders safe, and limit the spread of COVID-19. City bus drivers also have access to, and and wear, masks",government,wear masks,,mm09,https://www.icgov.org/news
Iowa,,4/10/2020,"the Iowa Department of Public Health issued a PPE (personal protective equipment) shortage order, requiring health care providers to reuse face masks, use washable gowns, minimize contact with patients, cancel all non-essential appointments and procedures and utilize telemedicine “whenever possible.”",other,other,personal protective equipment shortage,KS59,https://iowastartingline.com/iowa-covid-19-timeline/
Iowa,,4/11/2020,Kim Reynolds announces new food assistance taskforce,other,new public service,food bank,KS59,https://www.iowastatedaily.com/news/iowa-governor-kim-reynolds-lieutenant-adam-gregg-coronavirus-covid-19-pandemic-epidemic-food-bank-pantry/article_39b2b5ee-7b44-11ea-be8d-ebebbc15c509.html
Iowa,,4/16/2020,Released an updated dashboard about demographic information and Iowa's epidemiological curve regarding COVID-19,government,new public service,COVID-19 dashboard,KS59,https://www.nga.org/coronavirus/
Kansas,,3/11/2020,Edgerton announced that all Parks and Recreation events have canceled through the end of April as well as the Low-Cost Animal Vaccine Clinic.,government,movement restriction,,LH16,https://www.livescience.com/kansas-coronavirus.html
Kansas,,3/11/2020,"The Johnson County Library said all library-sponsored programs and events are canceled, and library volunteers are asked not to report for duty.",government,movement restriction,,LH16,https://www.livescience.com/kansas-coronavirus.html
Kansas,,3/11/2020,Metropolitan Community College said it would be closed from Thursday,government,school closing,,LH16,https://www.livescience.com/kansas-coronavirus.html
Kansas,,3/11/2020,The Lawrence/Douglas County Department of Public Health says it has canceled the city's St. Patrick's Day parade.,other,events cancelled,,LH16,https://www.livescience.com/kansas-coronavirus.html
Kansas,,3/12/2020,The Governor declared a state of emergency.,government,state of emergency,,LH16,https://www.nga.org/coronavirus/
Kansas,,3/15/2020,The executive orders ban gatherings of over 50 people and suspend utility disconnects until April 15.,government,school closing,,LH16,https://www.livescience.com/kansas-coronavirus.html
Kansas,,3/16/2020,"Park University said all classes will move online beginning Monday, March 16.",government,school closing,,LH16,https://www.livescience.com/kansas-coronavirus.html
Kansas,,3/16/2020,The University of Missouri - Kansas City announced Thursday afternoon plans to switch to online-learning,government,school closing,,LH16,https://www.livescience.com/kansas-coronavirus.html
Kansas,,3/17/2020,Gov. Laura Kelly announces executive orders to encourage social distancing (No more than 50 people should gather),government,movement restriction,,LH16,https://www.livescience.com/kansas-coronavirus.html
Kansas,,3/17/2020,All University of Kansas classes are moving online for the rest of the semester and there will be a limited on-campus presence.,government,school closing,,LH16,https://www.livescience.com/kansas-coronavirus.html
Kansas,,3/17/2020,extending states of local disaster emergency relating to COVID-19,government,state of emergency,,CE75,https://governor.kansas.gov/newsroom/executive-orders/
Kansas,Topeka,3/18/2020,City of Topeka closes public building including Topeka Zoo,government,state of emergency,,HD09,https://data.topeka.org/pages/covid19information
Kansas,,3/18/2020,temporarily prohibiting evictions and foreclosures,government,other,,CE75,https://governor.kansas.gov/newsroom/executive-orders/
Kansas,,3/20/2020,reorganizing the Kansas Early Childhood Advisory Council,government,school closing,,CE75,https://governor.kansas.gov/newsroom/executive-orders/
Kansas,,3/22/2020,temporarily expanding telemedicine and addressing certain licensing requirements to combat the effects of COVID-19,government,new public services,,CE75,https://governor.kansas.gov/newsroom/executive-orders/
Kansas,,3/22/2020,conditional and temporary relief from certain motor carrier rules and regulations in response to the COVID-19 pandemic,government,other,,CE75,https://governor.kansas.gov/newsroom/executive-orders/
Kansas,,3/23/2020,Gov. Laura Kelly announced that she will be issuing an executive order that limits gatherings to a maximum of 10 people during a press conference,government,movement restriction,,LH16,https://www.livescience.com/kansas-coronavirus.html
Kansas,Douglas,3/24/2020,County of Douglas announced Shelter in place,government,stay at home,,HD09,https://www.kwch.com/content/news/About-a-third-of-Kansas-population-told-to-stay-home-569029151.html
Kansas,,3/24/2020,rescinding E.O. 20-06 and temporarily prohibiting certain foreclosures and evictions,government,other,,CE75,https://governor.kansas.gov/newsroom/executive-orders/
Kansas,,3/24/2020,temporarily requiring continuation of waste removal and recycling services,government,new public services,,CE75,https://governor.kansas.gov/newsroom/executive-orders/
Kansas,,3/24/2020,drivers' license and vehicle registration and regulation during public health emergency,government,other,,CE75,https://governor.kansas.gov/newsroom/executive-orders/
Kansas,,3/24/2020,allowing certain deferred tax deadlines and payments during the COVID-19 pandemic,government,public service reduction,,CE75,https://governor.kansas.gov/newsroom/executive-orders/
Kansas,,3/24/2020,temporarily prohibiting mass gatherings of 10 or more people to limit the spread of COVID-19 and rescinding Executive Order 20-04,government,movement restriction,,CE75,https://governor.kansas.gov/newsroom/executive-orders/
Kansas,,3/24/2020,establishing the Kansas Essential Function Framework for COVID-19 response efforts,government,other,,CE75,https://governor.kansas.gov/newsroom/executive-orders/
Kansas,Topeka,3/25/2020,City of Topeka doesn't allow the public into chamber meeting,government,public service reduction,,HD09,https://data.topeka.org/pages/covid19information
Kansas,,3/25/2020,The Centers for Medicare & Medicaid Services (CMS) approved Kansas’ request for a Section 1135 Medicaid waiver.,government,other,,LH16,https://www.nga.org/coronavirus/
Kansas,Topeka,3/26/2020,"A Safer at Home Order has been issued for Topeka and Shawnee County. Beginning Thursday, March 26 at 12:01 a.m., residents will be directed to stay at home to help limit the spread of COVID-19. This order is in effect until April 26, 2020.",government,stay at home,,CE75,https://governor.kansas.gov/newsroom/executive-orders/
Kansas,Sedgwick,3/27/2020,Kansas extends driver license renewal deadline,government,other,,HD09,https://www.wichita.gov/COVID19Docs/License%20and%20Tag%20Renewal%20Extension%20Release%203.26.20.pdf
Kansas,,3/28/2020,"Governor Laura Kelly issued a statewide stay home order, stating that all residents should stay home unless performing essential activities, such as obtaining food or seeking medical care. The order went into effect at 12:01 a.m.",government,stay at home,,LH16,https://www.livescience.com/kansas-coronavirus.html
Kansas,Sedgwick,3/30/2020,First death in Sedgewick County Kansas,government,other,,HD09,https://www.wichita.gov/COVID19Docs/Release%20-%20Confirms%20First%20Death%203.30.20.pdf
Kansas,,3/30/2020,"all students will start online learning, with the campus remaining closed.",government,school closing,,LH16,https://www.livescience.com/kansas-coronavirus.html
Kansas,,3/31/2020,temporarily relief from certain unemployment insurance requirements in response to the COVID-19 pandemic,government,new public services,,CE75,https://governor.kansas.gov/newsroom/executive-orders/
Kansas,,4/6/2020,Kansas Department of Health and Environment added Connecticut to self quarantine list,government,movement restriction,,HD09,https://khap2.kdhe.state.ks.us/NewsRelease/PDFs/4-6-20%20travel.pdf
Kansas,,4/6/2020,Kansas Department of Health and Environment added Louisiana and Colorado to self quarantine list,government,movement restriction,,HD09,https://khap2.kdhe.state.ks.us/NewsRelease/PDFs/4-6-20%20travel.pdf
Kansas,,4/6/2020,Kansas Department of Health and Environment added Illinios and New Jersey to self quarantine list,government,movement restriction,,HD09,https://khap2.kdhe.state.ks.us/NewsRelease/PDFs/4-6-20%20travel.pdf
Kansas,,4/6/2020,"Kansas Department of Health and Environment added California, Florida, New York and Washington to self quarantine list",government,movement restriction,,HD09,https://khap2.kdhe.state.ks.us/NewsRelease/PDFs/4-6-20%20travel.pdf
Kansas,,4/6/2020,"Kansas Department of Health and Environment added the following Colorado counties to self quarantine list, Eagle, Summit, Pitkin and Gunnison",government,movement restriction,,HD09,https://khap2.kdhe.state.ks.us/NewsRelease/PDFs/4-6-20%20travel.pdf
Kansas,,4/6/2020,Kansas Department of Health and Environment added Louisiana and Colorado to quarantine list,government,movement restriction,,HD09,https://khap2.kdhe.state.ks.us/NewsRelease/PDFs/4-6-20%20travel.pdf
Kansas,,4/6/2020,"Kansas Department of Health and Environment order those who have travelled on a cruise ship, or travelled internationally on or after march 15th to self quarantine for 14 days at home",government,movement restriction,,HD09,https://khap2.kdhe.state.ks.us/NewsRelease/PDFs/4-6-20%20travel.pdf
Kansas,,4/7/2020,temporarily prohibiting mass gatherings of more than 10 people to limit the spread of COVID-19 and rescinding Executive Order 20-14,government,movement restriction,,CE75,https://governor.kansas.gov/newsroom/executive-orders/
Kansas,,4/8/2020,Towing service goes to online auction of repossesed vehicles,other,new public service,,HD09,https://www.kcmo.gov/Home/Components/News/News/295/625
Kansas,Sedgwick,4/9/2020,"Alerts residents of text message scam exploding due to COVID-19, offers a place to report it",government,new public service,,HD09,https://www.wichita.gov/COVID19Docs/Release%20-%20Spam%20texts%204.8.20.pdf
Kansas,,4/9/2020,extending professional and occupational licenses during the COVID-19 pandemic,government,other,,CE75,https://governor.kansas.gov/newsroom/executive-orders/
Kansas,,4/9/2020,temporarily allowing notaries and witnesses to act via audio-video communication technology,government,new public services,,CE75,https://governor.kansas.gov/newsroom/executive-orders/
Kansas,,4/9/2020,suspending the issuance of general nonresident spring 2020 turkey permits,government,other,,CE75,https://governor.kansas.gov/newsroom/executive-orders/
Kansas,Sedgwick,4/10/2020,Announces specific order to refrain from gathering in excess of 10 people,government,movement restriction,,HD09,https://www.wichita.gov/COVID19Docs/Release%20-%20Religious%20Gatherings%204.10.20%20revised.pdf
Kansas,,4/10/2020,"Total number of cases in Kansas: 1166, total deaths in Kansas: 50",government,other,,HD09,https://www.wichita.gov/COVID19Docs/DB%204.10.20.%20346p.pdf
Kansas,,4/15/2020,The Governor has extended the stay-at-home order until May 1st.,government,stay at home,extended again,LH16,https://www.nga.org/coronavirus/
Kansas,,4/16/2020,The Governor has signed an executive order extending the stay-at-home order to May 3.,government,stay at home,extended again,HD09,https://www.nga.org/coronavirus/
Kentucky,Lexington,3/6/2020,"At the urging of Governor Andy Beshear, Gorton declared a state of emergency to gain access to additional resources if needed.",government,state of emergency,,NC52,https://www.lexingtonky.gov/news/03-06-2020/mayor-confirms-first-covid-19-case-lexington
Kentucky,,3/6/2020,Governer Beshear declares Public Health Emergency,government,state of emergency,,PR48,https://www.courier-journal.com/story/news/2020/03/06/what-is-state-of-emergency-coronavirus/4974968002/
Kentucky,,3/7/2020,Announced Kentucky's COVID-19 hotline and Kentucky's COVID-19 informational website,government,new public services,kycovid19.ky.gov,NC52,https://governor.ky.gov/covid19
Kentucky,,3/7/2020,Recommended social distancing for those with high-risk,government,other,,NC52,https://governor.ky.gov/covid19
Kentucky,,3/7/2020,"The Governor issued guidance for high risk populations, as well as state employees on how to protect themselves and others. This includes modification to state sick leave policies.",government,new public services,Hotline,PR48,https://www.nga.org/coronavirus/
Kentucky,,3/10/2020,"​Limited visits to long-term care facilities and nursing homes, and closed all state prisons to visitors",government,movement restriction,,NC52,https://louisvilleky.gov/news/what-you-need-know-about-coronavirus
Kentucky,,3/11/2020,Suspended out-of-state travel for state employees.,government,movement restriction,,NC52,https://governor.ky.gov/covid19
Kentucky,,3/11/2020,Governor Beshear instructed school districts to be prepared to close schools on short notice,government,school closing,,TJ73,https://www.nga.org/coronavirus/
Kentucky,,3/11/2020,Governor Beshear urged more businesses to allow employees to tele-commute and to provide paid sick leave,government,work restrictions,,PR48,https://www.nga.org/coronavirus/
Kentucky,,3/11/2020,Governor Beshear asked places of worship to temporarily cancel services. ,government,non-essential closing,,TJ73,https://www.nga.org/coronavirus/
Kentucky,Louisville,3/12/2020,Mayor Greg Fischer has ordered all events hosted or permitted by Louisville Metro Government or held in a Louisville Metro facility be postponed or canceled,government,events cancelled,Through April 5,NC52,https://louisvilleky.gov/news/what-you-need-know-about-coronavirus
Kentucky,Lexington,3/13/2020,"Mayor Linda Gorton today announced the city will suspend programs for seniors, effective Friday, March 13, because of COVID-19",government,events cancelled,Gorton said the programming will be reinstated as soon as possible,NC52,https://www.lexingtonky.gov/news/03-12-2020/city-suspends-programs-seniors
Kentucky,Louisville,3/14/2020,"Mayor Greg Fischer today announced a temporary closure, effective immediately, of all 17 Louisville Free Public Library locations, 13 community centers, the Mary T. Meagher Aquatic Center and some indoor Zoo attractions.",government,non-essential closing,,NC52,https://louisvilleky.gov/news/mayor-calls-temporary-closures-libraries-community-centers-mary-t-meagher-aquatics-center-and
Kentucky,,3/15/2020,The Governor asked all Kentucky hospitals to cease providing elective surgery and for daycare facilities to begin planning for closure,government,public service reduction,,PR48,https://www.nga.org/coronavirus/
Kentucky,Louisville,3/16/2020,Inmate visitation is suspended immediately at Louisville Jail,government,movement restriction,At least three weeks,NC52,https://louisvilleky.gov/news/what-you-need-know-about-coronavirus
Kentucky,Bowling Green,3/16/2020,Bowling Green and Warren County governments declared a state of emergency Monday to help deal with the local fallout from the coronavirus pandemic.,government,state of emergency,,NC52,https://www.bgdailynews.com/news/city-county-declare-state-of-emergency/article_3bf8d346-782d-5a74-bbce-e89d3c5fe5dc.html
Kentucky,,3/16/2020,"In his announcement, the governor also directed all restaurants and bars to close with the exceptions of drive through and delivery. The State Capital building will be closing to all nonessential personnel.",government,non-essential closing,,TJ73,https://www.livescience.com/kentucky-coronavirus.html
Kentucky,,3/16/2020,The state's primary elections were suspended until 23 June.[9],government,events cancelled,,TJ73,https://en.wikipedia.org/wiki/2020_coronavirus_pandemic_in_Kentucky
Kentucky,Louisville,3/17/2020,"The 2020 Kentucky Derby will be postponed to Saturday, September 5 due to ongoing precautions for the coronavirus outbreak",other,events cancelled,"Initially scheduled for Saturday, May 2.",NC52,https://sports.nbcsports.com/2020/03/17/kentucky-derby-2020-postponed-coronavirus/
Kentucky,,3/17/2020,Gov Beshear signs executive order to close all entertainment and recreational facilities,government,non-essential closing,,PR48,https://www.livescience.com/kentucky-coronavirus.html
Kentucky,,3/17/2020,The Governor announced a three-month extension of driver’s licenses,government,other,,PR48,https://www.nga.org/coronavirus/
Kentucky,,3/18/2020,Suspended all charitable gaming licenses.,government,non-essential closing,,NC52,https://governor.ky.gov/covid19
Kentucky,,3/18/2020,The Governor announced that the state is working with federal partners to continue Child Care Assistance Program payments on behalf of qualified families during the mandatory closure period. The state will also be covering copayments typically covered by families.,government,new public services,,TJ73,https://www.nga.org/coronavirus/
Kentucky,Covington,3/19/2020,Joe Meyer declares state of emergency,government,state of emergency,,PR48,https://www.cincinnati.com/story/news/2020/03/19/coronavirus-kentucky-covington-mayor-joe-meyer-declares-state-emergency/2880539001/
Kentucky,,3/19/2020,Beshear issued a letter formally banning all mass gatherings.,government,movement restriction,,TJ73,https://www.livescience.com/kentucky-coronavirus.html
Kentucky,,3/20/2020,Gov. Beshear recommends Kentucky schools stay closed longer.,other,school closing,"Wants schools to stay closed through Friday, April 17.",PR48,https://www.wlwt.com/article/kentucky-schools-asked-to-extend-closure-amid-coronavirus-spread/31822571#
Kentucky,,3/20/2020,"All adult day care centers must be closed by March 20. Acute, psychiatric, senior care facilities and intermediate care facilities are being asked to restrict visitations.",government,non-essential closing,,TJ73,https://www.livescience.com/kentucky-coronavirus.html
Kentucky,,3/20/2020,The Governor announced Kentucky unemployment insurance implements new procedures to manage the influx of claims including new phonelines and video conference services.,government,new public services,,TJ73,https://www.nga.org/coronavirus/
Kentucky,,3/22/2020,"Starting at 8 p.m. March 23, all nonessential retail will be ordered closed to in-person traffic.",government,non-essential closing,Restrictions on businesses,PR48,https://www.courier-journal.com/story/news/local/2020/03/22/kentucky-coronavirus-beshear-orders-nonessential-businesses-close/2895931001/
Kentucky,,3/23/2020,Gov. Beshear signed an executive order to cease all elective medical procedures.,government,non-essential closing,,NC52,https://governor.ky.gov/covid21
Kentucky,Lexington,3/23/2020,Yard waste service will be suspended to ensure City has personnel needed to pick up solid waste and recyclables.,government,public service reduction,,NC52,https://governor.ky.gov/covid22
Kentucky,Louisville,3/24/2020,Mayor Greg Fischer today extended to May 10 the state of emergency he enacted to help stop the COVID-19 outbreak in Louisville,government,state of emergency,Until May 10,NC52,https://governor.ky.gov/covid23
Kentucky,,3/24/2020,Stay at home order,government,stay at home,Beshear signs executive order for people to stay at home,PR48,https://www.livescience.com/kentucky-coronavirus.html
Kentucky,Louisville,3/24/2020,"Mayor Greg Fischer of Louisville ordered the closure of playgrounds, basketball courts and soccer fields in the city's parks on March 24.[12]",government,non-essential closing,,TJ73,https://en.wikipedia.org/wiki/2020_coronavirus_pandemic_in_Kentucky
Kentucky,,3/25/2020,The Governor signed legislation waiving in-person school attendance requirements and giving school districts permission to engage in nontraditional/remote learning.,government,school closing,,PR48,https://www.nga.org/coronavirus/
Kentucky,Lexington,3/26/2020,"Fayette County District Court has released 48 non-felon, low risk, non-violent inmates from the jail to make it safer for the remaining inmates",government,other,,NC52,https://governor.ky.gov/covid24
Kentucky,,3/26/2020,"Beshear announced that all businesses that aren’t ""life-sustaining"" must close to in-person traffic by end-of-business March 26, the Herald Leader reported.",government,non-essential closing,,TJ73,https://www.livescience.com/kentucky-coronavirus.html
Kentucky,Louisville,3/27/2020,He said drive-thru testing is now available by appointment only through the University of Louisville and the Veterans Affairs.,government,new public services,,TJ73,https://www.wkyufm.org/post/live-blog-how-coronavirus-impacting-life-kentucky#stream/8
Kentucky,,3/28/2020,"President Donald Trump signed a new disaster declaration for Kentucky, giving it access to additional funds. The agreement will allow the Federal Emergency Management Agency to reimburse the state for measures taken to combat the coronavirus. The federal government will cover up to 75 percent of costs for supplies, extra assistance from law enforcement, temporary medical facilities among other expenses.",government,new public services,,TJ73,https://www.wkyufm.org/post/live-blog-how-coronavirus-impacting-life-kentucky#stream/6
