State,County,Date,Raw Description,Information type,Mitigation type,Note,UserID,Source
Connecticut,,3/21/2020,The University of Hartford says remote instruction will continue through the end of the Spring semester. Students that remain on campus during Spring break have been asked to return home,government,school closing,,LH16,https://www.wfsb.com/news/the-latest-coronavirus-cases-in-the-state-surpass-11-500/article_54edec52-67ad-11ea-8482-877cb5d00dcd.html
Connecticut,,3/21/2020,"Connecticut's Department of Revenue Services (DRS) is extending the filing and payment deadline for personal income tax returns 90 days, to July 15, 2020.",government,other,,LH16,https://www.wfsb.com/news/the-latest-coronavirus-cases-in-the-state-surpass-11-500/article_54edec52-67ad-11ea-8482-877cb5d00dcd.html
Connecticut,,3/21/2020,"The Governor issued an executive order providing broad relief for municipalities regarding procedures, notice requirements, and deadlines for various proceedings and decisions. In addition, the executive order enacts several necessary changes related to Medicare Part D and HUSKY B costs, student privacy, visitation in the Department of Children and Families facilities, pharmacy regulations, and corporate meetings.",government,new public services,,LH16,https://www.nga.org/coronavirus/
Connecticut,,3/22/2020,"larification of ""Stay Safe, Stay Home"" Executive Order No. 7H regarding nonessential business operations, Extension of time period for fire service personnel examinations, Delivery of methadone to homebound patients by methadone maintenance clinics, Suspension of rehiring procedures and restrictions on temporary worker retirees, Modification of real property statutes to facilitate leasing, repairs, alterations and use of real property, Modification of state contracting statutes to facilitate leasing, repairs, alterations, and use of real property",Government,other,"Clarification of stay safe, stay home order",LB10,https://portal.ct.gov/Coronavirus/Pages/Emergency-Orders-issued-by-the-Governor-and-State-Agencies
Connecticut,,3/22/2020,The order goes into effect Monday at 8 p.m. and orders all non-essential businesses to close.,government,work restriction,,LH16,https://www.wfsb.com/news/the-latest-coronavirus-cases-in-the-state-surpass-11-500/article_54edec52-67ad-11ea-8482-877cb5d00dcd.html
Connecticut,,3/23/2020,"Suspension of non-critical probate court operations, Suspension of non-critical Workers' Compensation Commission operations, Authorization of remote notarization, Modification of DPH regulatory requirements, Suspension of national criminal history records checks for long-term care providers",Government,public service reduction,Court closures,LB10,https://portal.ct.gov/Coronavirus/Pages/Emergency-Orders-issued-by-the-Governor-and-State-Agencies
Connecticut,,3/23/2020,"Stay Safe, Stay Home restrictions on all workplaces for non-essential business, Requirement of a coordinated effort between the State of Connecticut and its municipalities",government,stay at home,,MA35,https://portal.ct.gov/DECD/Content/Coronavirus-Business-Recovery
Connecticut,University of New Haven,3/23/2020,classes move to online format,other,movement restriction,,MA35,https://abc7ny.com/coronavirus-cases-update-ct/5991616/
Connecticut,,3/23/2020,order for all non-essential businesses to shut down in person activities,government,non-essential closing,,MA35,https://abc7ny.com/coronavirus-cases-update-ct/5991616/
Connecticut,,3/23/2020,DOC employees will have to pass a wellness screening check before entering a facility.,other,work restriction,,LH16,https://www.wfsb.com/news/the-latest-coronavirus-cases-in-the-state-surpass-11-500/article_54edec52-67ad-11ea-8482-877cb5d00dcd.html
Connecticut,,3/23/2020,"The Governor announced drive-through testing sites have been added at 5 more hospitals, bringing the statewide total of these alternate testing locations to 21.",government,new public services,,LH16,https://www.nga.org/coronavirus/
Connecticut,,3/24/2020,"Extension of class cancellations at all public schools to April 20, Early opening of fishing season, Suspension of restrictions on reemployment of municipal retirees, Flexibility to maintain adequate medical marijuana access for patients, Extension of time period for nursing home transfers, Modification of the duties of registrars of vital records, Modification of in-person purchase of and access to copies of vital records, Modification of marriage license requirements",Government,other,Extended school closures to 4-20,LB10,https://portal.ct.gov/Coronavirus/Pages/Emergency-Orders-issued-by-the-Governor-and-State-Agencies
Connecticut,,3/24/2020,"The Archdiocese of Hartford has extended the cancellation of public masses from April 3 until April 30 at churches throughout Hartford, Litchfield, and New Haven counties. This includes the liturgies of Holy Week and Easter.",other,events cancelled,,LH16,https://www.wfsb.com/news/the-latest-coronavirus-cases-in-the-state-surpass-11-500/article_54edec52-67ad-11ea-8482-877cb5d00dcd.html
Connecticut,Fairfield,3/25/2020,"The Danbury Judicial District Courthouse located at located at 146 White Street was closed effective Thursday, March 26, 2020. All cases that would otherwise be handled in the Danbury courthouse have been transferred to the Waterbury GA Courthouse at 400 Grand Street, effective Thursday, March 26, 2020. This transfer of business will be in effect until further notice.",Government,public service reduction,Danbury Court closed,LB10,https://jud.ct.gov/COVID19.htm
Connecticut,,3/25/2020,early fishing season to encourage social distancing,government,other,expanded distancing activity,MA35,https://abc7ny.com/coronavirus-cases-update-ct/5991616/
Connecticut,,3/25/2020,"The Connecticut’s Office of Healthcare Strategy (OHS) issued an order further streamlining the approval and licensure process for the state’s hospitals to simply complete a notification form, rather than apply for a Certificate of Need waiver.",government,new public services,,LH16,https://www.nga.org/coronavirus/
Connecticut,,3/26/2020,"In recognition of the public health emergency declaration issued by Governor Lamont, and due to the concern over the spread of the COVID19/Coronavirus, no oral arguments will be scheduled at the Appellate Court during the court's seventh term (April 6-April 24, 2020). With the agreement of all counsel of record, fully briefed and ready cases may be submitted for disposition based on the briefs, appendices and record, without oral argument. If possible, requests for disposition without oral argument should be filed with the Office of the Appellate Clerk by April 15, 2020. These requests must be filed as ""Correspondence to Court Regarding Waiver of Oral Argument"" which is listed under the ""Preliminary Paper/Appeal Document"" section in the Appellate E-filing.",Government,public service reduction,Appellate court april term arguments cancelled,LB10,https://jud.ct.gov/COVID19.htm
Connecticut,,3/26/2020,"Three courthouses -- the Litchfield Judicial District courthouse located at 50 Field St., Torrington; the Geographical Area (GA) #19 courthouse located at 20 Park St. in Rockville; and the GA #11 courthouse located at 120 School St. in Danielson – will be temporarily closed until further notice, effective at the close of business on Friday, March 27, 2020. Effective, Monday, March 30, 2020, matters from Litchfield will transfer to the Waterbury GA #4 courthouse; matters from Rockville will transfer to the Hartford GA #14 courthouse; and matters from Danielson will transfer to the New London Judicial District courthouse.",Government,public service reduction,3 more court closings,LB10,https://jud.ct.gov/COVID19.htm
Connecticut,,3/26/2020,"Further reduction of social and recreational gatherings to 5 people, Restrictions on restaurant payment and pickup operations, Further restrictions on retail operations, Requirement of firearms transactions by appointment only, Suspension of tax on single-use checkout bags, Prohibition of employers from requiring employees to place items in customers' reusable bags, Suspension of 21-month limit on Temporary Family Assistance, Suspension of school testing assessments for 2019-20 school year",Government,other,limited public gatherings to 5 persons,LB10,https://portal.ct.gov/Coronavirus/Pages/Emergency-Orders-issued-by-the-Governor-and-State-Agencies
Connecticut,,3/26/2020,disaster aid relief requested from FEMA,government,other,call for help,MA35,https://abc7ny.com/coronavirus-cases-update-ct/5991616/
Connecticut,New Haven,3/26/2020,Call for local residents to register for medial reserve corps,government,other,,MA35,https://www.newhavenct.gov/news/default.htm
Connecticut,,3/27/2020,"The Centers for Medicare & Medicaid Services (CMS) approved Connecticut’s request for a Section 1135 Medicaid waiver. The approved waiver enables Connecticut to provide flexibilities in Medicaid provider screening and enrollment, lift prior authorization requirements, allow for reimbursement facility services in alternative settings, extend fair hearing timelines, and waive public comment and tribal consultation requirements for certain changes to the Medicaid state plan",government,new public services,,MA35,https://www.nga.org/coronavirus/
Connecticut,,3/27/2020,"Simplified licensing and inspections for multiple public health services which enabled production of hand sanitizer, allowing health care providers to work at facilities they were not previously regsitered, and provided easier access to child care.",government,new public services,,MA35,https://www.nga.org/coronavirus/
Connecticut,,3/27/2020,The Connecticut Department of Motor Vehicles (DMV) approved a request from licensed driving schools in the state to provide online classroom training to their students.,government,new public services,,MA35,https://www.nga.org/coronavirus/
Connecticut,,3/28/2020,"CDC advised residents of New York, New Jersey, and Connecticut to only travel for essential purposes",government,stay at home,,MA35,https://en.wikipedia.org/wiki/2020_coronavirus_pandemic_in_Connecticut
Connecticut,,3/28/2020,The Governor issued an executive order authorizing to provide for non-congregant housing for persons at risk.,government,new public services,housing provide for persons-at rick,MA35,https://www.nga.org/coronavirus/
Connecticut,,3/29/2020," The Connecticut Department of Public Health issued an order directing state, local, and private sector partners to transition the homeless population into alternative, less congested housing for the purpose of providing adequate social distancing between all individuals.",Government,other,homeless population moved into housing to encourage social distancing,LB10,https://jud.ct.gov/COVID19.htm
Connecticut,,3/29/2020,The Governor announced that the President has approved his request in declaring a Major Disaster for the State of Connecticut.,Government,state of emergency,,LB10,https://jud.ct.gov/COVID19.htm
Connecticut,,3/30/2020,The Department of Revenue Services (DRS) announced that it will be granting a two-month extension of filing and payment deadlines for certain small businesses.,Government,other,2 month extention on filing and payment dealines,LB10,https://jud.ct.gov/COVID19.htm
Connecticut,,3/30/2020,"The Connecticut Bar Examining Committee announced today that, due to the ongoing public health emergency arising from the COVID-19 pandemic, the Connecticut bar examination will not be administered on July 28 – 29, 2020 as previously scheduled. The bar exam has been postponed until fall, on dates to be determined.",Government,events cancelled,July bar exams cancelled,LB10,https://jud.ct.gov/COVID19.htm
Connecticut,Bridgeport,3/30/2020,Sports arena converted into field hospital,government,new public services,field hospital,MA35,https://abc7ny.com/coronavirus-cases-update-ct/5991616/
Connecticut,,3/30/2020,"State leaders are looking at everything from nursing homes that are no longer in use, to college dorms, and even venues like the Connecticut Convention Center, Webster Bank Arena, and even Mohegan Sun as possible hospital overflow sites.",government,other,,LH16,https://www.wfsb.com/news/the-latest-coronavirus-cases-in-the-state-surpass-11-500/article_54edec52-67ad-11ea-8482-877cb5d00dcd.html
Connecticut,,3/30/2020,"The Governor issued an executive order taking the following actions: Requirement of limited group sizes in childcare: The order requires all childcare facilities to limit group sizes to no more than 10 children in one space. Enhancement of health procedures for all operating childcare programs: The order requires all children and childcare staff to be checked at the entrance of childcare facilities for any observable illness, including cough or respiratory distress, and to confirm temperature below 100 degrees Fahrenheit. Authorization of remote notarization: The order eliminates all existing legal requirements to have a signature on any document witnessed by a third party, except in the case of a last will and testament.",government,other,cap on number of children in childcare,LB10,https://www.nga.org/coronavirus/
Connecticut,,3/30/2020,"The Department of Public Health (DPH) issued an order suspending the need for all DPH licensees to renew their licenses throughout the duration of the declared COVID-19 emergency. DPH also temporarily modified the authority of sub registrars of vital statistics, who are appointed by the local registrars of vital statistics, allowing them to issue burial transit, removal, and cremation permits for any death occurring in any town within the state for the duration of the public health and civil preparedness emergency.",government,other,order suspended need to unit permits during emergency,LB10,https://www.nga.org/coronavirus/
Connecticut,,3/31/2020,"The Governor announced an agreement with more than 50 credit unions and banks in Connecticut to offer mortgage relief to the state’s residents and businesses. Under the agreement, the following relief policies are being offered by participating financial institutions: 90-day grace period for all mortgage payments; Relief from fees and charges for 90 days; No new foreclosures for 60 days; and No credit score changes for accessing relief.",government,new public services,extention of licenses and reduction in tax collection dates,LB10,https://www.nga.org/coronavirus/
Connecticut,,3/31/2020,"The Governor issued an executive order taking the following actions: Continuation of funding for boards of education; Continuation of payment of public school staff; Preservation of student transportation services and special education providers;Restrictions on entrance to state parks, forests, and other lands; and Permitting curbside pickup of alcoholic beverages. ",government,pubilc service reduction,"parks closed, funds continued for education",LB10,https://www.nga.org/coronavirus/
Connecticut,,3/31/2020,"The Connecticut Office of Health Strategy (OHS) released revised guidance and is now including outpatient surgical facilities among those required to simply complete a notification form, rather than apply for a Certificate of Need (CON) waiver.",government,other,outpatient facilities requirements changed,LB10,https://www.nga.org/coronavirus/
Connecticut,,4/1/2020,"The Governor issued an executive order taking the following actions: Requiring retail establishment to take additional protective measures to reduce the risk of transmission; Establishing a 60-day grace period for premium payments, policy cancellations, and non-renewals of insurance policies; Extending the 30-day period of credit for liquor permittees; Changing daily payment of certain taxes to weekly; Providing flexibility to amend Medicaid waivers and state plan; Relieving certain municipal tax deadlines and collection efforts; Allowing suspension of in-person voting requirements for critical and time sensitive municipal fiscal deadlines; Suspending of reapplication filing requirement for the homeowners’ elderly/disabled circuit breaker tax relief program and for the homeowners’ elderly/disabled freeze tax relief program; Substituting full inspection requirements pertaining to October 1, 2020 grand list revaluations; Extending of deadline to file income and expense statement to August 15; and Suspending of non-judicial tax sales.",Government,public service reduction,changed public services to increase social distancing,LB10,https://www.nga.org/coronavirus/
Connecticut,,4/1/2020,"Safe stores mandatory statewide rules, 60-day grace period for premium payments, policy cancellations, and non-renewals of insurance policies, Extension of 30-day period of credit for liquor permittees, Daily payment of certain taxes changed to weekly, Flexibility to amend Medicaid waivers and state plan, Relief from certain municipal tax deadlines and collection efforts, Allow suspension of in-person voting requirements for critical and time sensitive municipal fiscal deadlines, Suspension of reapplication filing requirement for the homeowners’ elderly/disabled circuit breaker tax relief program and for the homeowners’ elderly/disabled freeze tax relief program, Substitution of full inspection requirements pertaining to October 1, 2020 grand list revaluationsm, Extension of deadline to file income and expense statement to August 15, Suspension of non-judicial tax sales",Government,other,added grace periods for certain businesses,LB10,https://portal.ct.gov/Coronavirus/Pages/Emergency-Orders-issued-by-the-Governor-and-State-Agencies
Connecticut,,4/1/2020,The state Department of Energy and Environmental Protection reduced the number visitors that can be at state parks.,government,movement restriction,,LH16,https://www.wfsb.com/news/the-latest-coronavirus-cases-in-the-state-surpass-11-500/article_54edec52-67ad-11ea-8482-877cb5d00dcd.html
Connecticut,,4/2/2020,Lamont also issued an executive order for hotels and short-term rentals being reserved for essential workers.,government,other,,LH16,https://www.wfsb.com/news/the-latest-coronavirus-cases-in-the-state-surpass-11-500/article_54edec52-67ad-11ea-8482-877cb5d00dcd.html
Connecticut,,4/2/2020,"The Governor issued an executive order taking the following actions: Prohibition on non-essential lodging except in the case for certain populations; Further clarification of limits on restaurants, bars, and private clubs; Suspension of notarization requirement related to Connecticut Recovery Bridge Loan Program; Flexibility to maintain adequate child care infrastructure; Suspension of rehearing rights for temporary rate increases for certain health care providers; and Alternative to affidavits in relation to orders of protection and relief.",government,other,updates on actions to increase relief,LB10,https://www.nga.org/coronavirus/
Connecticut,,4/2/2020,"Access Health CT, Connecticut’s health insurance marketplace, announced that it is extending the deadline for the new special enrollment period for uninsured residents to enroll in health insurance plans.",government,other,public insurance enrollment date extended,LB10,https://www.nga.org/coronavirus/
Connecticut,,4/2/2020,The Department of Social Services announced that it is extending the application period for the Connecticut Energy Assistance Program.,government,other,Energy assistance program application period extended,LB10,https://www.nga.org/coronavirus/
Connecticut,,4/2/2020,The Department of Social Services extended the Emergency Supplemental Nutrition Program (SNAP) benefits to nearly half of Connecticut SNAP participants on April 9 and April 20.,government,other,Food stamps benefits extended,LB10,https://www.nga.org/coronavirus/
Connecticut,,4/2/2020,"The Department of Revenue Services announced that the filing and payment deadline for gift tax returns is being extended until July 15, 2020.",government,other,tax filing deadline extended,LB10,https://www.nga.org/coronavirus/
Connecticut,,4/3/2020,"The Judicial Branch is implementing a new procedure for the remote filing of temporary restraining orders. A Governor’s Executive Order temporarily eliminates the requirement that applicants seeking a temporary restraining order must swear under oath that the statement is true and eliminates the need for a notary public or other authority to take the applicant’s oath, while still legally obligating the applicant to make true statements. More information is available here.",Government,other,Remote filing of restraining order opened,LB10,https://jud.ct.gov/COVID19.htm
Connecticut,,4/3/2020,Safe workplace rules for essential employers,government,work restriction,,MA35,https://portal.ct.gov/DECD/Content/Coronavirus-Business-Recovery
Connecticut,,4/3/2020,The Ledge Light Health District confirmed the first COVID-19 associated death in Stonington. The resident was a 94-year-old male. The Ledge Light Health district is urging everyone to promote social distancing to slow the spread of the virus.,government,social distancing,,LH16,https://www.wfsb.com/news/the-latest-coronavirus-cases-in-the-state-surpass-11-500/article_54edec52-67ad-11ea-8482-877cb5d00dcd.html
Connecticut,,4/3/2020,"Effective immediately, the state’s 213 nursing homes are receiving a 10 percent across-the-board increase in Medicaid payments to help meet extraordinary costs from the public health emergency.",government,new public services,,LH16,https://www.wfsb.com/news/the-latest-coronavirus-cases-in-the-state-surpass-11-500/article_54edec52-67ad-11ea-8482-877cb5d00dcd.html
Connecticut,,4/3/2020,Post University announces it will provide dormitory space to medical personnel and first responders working to fight COVID-19.,government,new public services,,LH16,https://www.wfsb.com/news/the-latest-coronavirus-cases-in-the-state-surpass-11-500/article_54edec52-67ad-11ea-8482-877cb5d00dcd.html
Connecticut,,4/4/2020,The Governor announced FEMA approved Connecticut’s request to include domestic violence survivors in non-congregate housing guidelines.,government,new public services,domestic violence survivor including in housing guidelines,LB10,https://www.nga.org/coronavirus/
Connecticut,New Haven,4/5/2020,Mayor Elicker also said the Health Department will be conducting inspections at grocery stores in New Haven to make sure they are complying with Governor Lamont's orders on social distancing.,government,other,inspection,LH16,https://www.wfsb.com/news/the-latest-coronavirus-cases-in-the-state-surpass-11-500/article_54edec52-67ad-11ea-8482-877cb5d00dcd.html
Connecticut,,4/5/2020,"The Governor issued an executive order taking the following actions: Protecting health care professionals and health care facilities, including nursing homes and field hospitals, from lawsuits for acts or omissions undertaken in good faith in support of the state’s COVID-19 response; and Protecting those who are uninsured and those who are insured and are treated by an out-of-network emergency services health care provider from surprise bills and other significant costs.",government,other,"lawsuit and ""surprise bills"" protection introduced in healthcare",LB10,https://www.nga.org/coronavirus/
Connecticut,,4/6/2020,"Kent Falls State park in Kent closed on Monday due to ""challenges maintaining appropriate social distancing.""",other,non-essential closing,,LH16,https://www.wfsb.com/news/the-latest-coronavirus-cases-in-the-state-surpass-11-500/article_54edec52-67ad-11ea-8482-877cb5d00dcd.html
Connecticut,,4/6/2020,DEEP said it would be closed for the duration of the public health emergency.,other,non-essential closing,,LH16,https://www.wfsb.com/news/the-latest-coronavirus-cases-in-the-state-surpass-11-500/article_54edec52-67ad-11ea-8482-877cb5d00dcd.html
Connecticut,,4/7/2020,Big Y World Class Market announces they will close for two days,government,work restriction,,LH16,https://www.wfsb.com/news/the-latest-coronavirus-cases-in-the-state-surpass-11-500/article_54edec52-67ad-11ea-8482-877cb5d00dcd.html
Connecticut,,4/7/2020,The Governor issued an executive order taking the following actions: Prescribing additional protective measures for essential businesses; Waiving the application fees for temporary permits for each of the health care professions; Allowing recent medical school and other medical profession graduates who are not yet licensed to participate in the state’s COVID-19 response for the duration of the public health and civil preparedness emergency; Allowing for those who have recently completed an accredited graduate degree program in marital and family therapy offered by a postgraduate clinical training program to practice without a license for the duration of the public health and civil preparedness emergency; Allowing recent graduates with a degree in clinical mental health counseling who are not yet licensed to practice as a professional counselor associate without obtaining a license for the duration of the public health and civil preparedness emergency; and Replacing the section of Executive Order No. 7U which adds protection from liability for common law claims – in addition to the previously enacted protection from liability for statutory claims – for healthcare workers and providers.,government,other,reduced restrictions on those who can practice without a ilcense during the emergency,LB10,https://www.nga.org/coronavirus/
Connecticut,,4/7/2020,"The Governor announced that manufacturers can apply for grants of up to $75,000 to assist in the production of critical equipment and supplies.",government,new public services,$75k grants openned to produce critical supplies,LB10,https://www.nga.org/coronavirus/
Connecticut,,4/8/2020,2 Nursing homes convert to coronavirus patients only,other,other,new private sector services,MA35,https://abc7ny.com/coronavirus-cases-update-ct/5991616/
