State,County,Date,Raw Description,Information type,Mitigation type,Note,UserID,Source
Minnesota,,3/23/2020,Directing Non-Hospital Entities to Inventory and Preserve Vital Medical Equipment During the COVID-19 Peacetime Emergency,government,other,,CE75,https://mn.gov/governor/news/executiveorders.jsp#/list/appId/1/filterType//filterValue//page/4/sort//order/
Minnesota,,3/23/2020,Clarifying Application of Executive Order 20-09 to Veterinary Surgeries and Procedures,government,other,,CE75,https://mn.gov/governor/news/executiveorders.jsp#/list/appId/1/filterType//filterValue//page/4/sort//order/
Minnesota,Minneapolis,3/24/2020,The University extended its travel restrictions on University-funded nonessential travel from April 30 to May 31.,other,movement restriction,,CE75,https://www.mndaily.com/article/2020/03/n-covid-19-response-a-university-of-minnesota-timeline
Minnesota,,3/25/2020,"Walz issues order asking Minnesotans to stay home unless absolutely necessary, for at least 2 weeks, beginning at midnight Friday. Schools are ordered closed until May 4.",government,stay at home,,CE75,https://www.startribune.com/minnesota-covid-19-pandemic-timeline/569112992/
Minnesota,,3/25/2020,"Continuing the Closure of Bars, Restaurants, and Other Places of Public Accommodation",government,non-essential closing,,CE75,https://mn.gov/governor/news/executiveorders.jsp#/list/appId/1/filterType//filterValue//page/4/sort//order/
Minnesota,,3/25/2020,Authorizing and Directing the Commissioner of Education to Implement a Distance Learning Period and Continue to Provide a Safe Learning Environment for Minnesota’s Students,government,school closing,,CE75,https://mn.gov/governor/news/executiveorders.jsp#/list/appId/1/filterType//filterValue//page/4/sort//order/
Minnesota,,3/25/2020,Directing Minnesotans to Stay at Home,government,stay at home,,CE75,https://mn.gov/governor/news/executiveorders.jsp#/list/appId/1/filterType//filterValue//page/4/sort//order/
Minnesota,,3/27/2020,Clarifying Application of Executive Order 20-07 to Allow for Coverage of Employees of Constitutional Officers,government,other,,CE75,https://mn.gov/governor/news/executiveorders.jsp#/list/appId/1/filterType//filterValue//page/4/sort//order/
Minnesota,,3/27/2020,Authorizing the State Auditor to Temporarily Suspend Reporting Requirements During the COVID-19 Peacetime Emergency,government,other,,CE75,https://mn.gov/governor/news/executiveorders.jsp#/list/appId/1/filterType//filterValue//page/4/sort//order/
Minnesota,,3/27/2020,Authorizing Minnesota Health-Related Licensing Boards to Modify Requirements During the COVID-19 Peacetime Emergency,government,other,,CE75,https://mn.gov/governor/news/executiveorders.jsp#/list/appId/1/filterType//filterValue//page/4/sort//order/
Minnesota,,3/27/2020,Providing for Emergency Relief from Regulations to Motor Carriers and Drivers Operating in Minnesota,government,new public services,,CE75,https://mn.gov/governor/news/executiveorders.jsp#/list/appId/1/filterType//filterValue//page/4/sort//order/
Minnesota,,3/31/2020,"Authorizing Peace Officers, Firefighters, and Security-Related Licensing Boards to Modify Requirements During the COVID-19 Peacetime Emergency",government,other,,CE75,https://mn.gov/governor/news/executiveorders.jsp#/list/appId/1/filterType//filterValue//page/4/sort//order/
Minnesota,,3/31/2020,Ensuring Continuing Operations of the Medical Cannabis Program during the COVID-19 Peacetime Emergency,government,other,,CE75,https://mn.gov/governor/news/executiveorders.jsp#/list/appId/1/filterType//filterValue//page/4/sort//order/
Minnesota,,4/4/2020,Providing for Emergency Relief from Regulations to Motor Carriers and Drivers Operating in Minnesota,government,new public services,,CE75,https://mn.gov/governor/news/executiveorders.jsp#/list/appId/1/filterType//filterValue//page/4/sort//order/
Minnesota,,4/6/2020,Allowing Out-of-State Mental Health Providers to Render Telehealth Aid and Permitting Certain Licensing Boards to Provide License and Registration Relief During the COVID-19 Peacetime Emergency,government,new public services,,CE75,https://mn.gov/governor/news/executiveorders.jsp#/list/appId/1/filterType//filterValue//page/4/sort//order/
Minnesota,,4/6/2020,Amending Executive Order 20-05 to Expedite State Unemployment Insurance Benefits During the COVID-19 Peacetime Emergency,government,new public services,,CE75,https://mn.gov/governor/news/executiveorders.jsp#/list/appId/1/filterType//filterValue//page/4/sort//order/
Minnesota,Minneapolis,4/6/2020,"Due to ongoing concerns about COVID-19, University of Minnesota President Joan Gabel announced in a system-wide email that all summer classes will be administered online.",other,school closing,,CE75,https://www.mndaily.com/article/2020/03/n-covid-19-response-a-university-of-minnesota-timeline
Minnesota,,4/8/2020,Providing for Relief from Regulations to Certain Motor Carriers and Drivers Operating in Minnesota,government,other,,CE75,https://mn.gov/governor/news/executiveorders.jsp#/list/appId/1/filterType//filterValue//page/4/sort//order/
Minnesota,,4/8/2020,Ensuring that Healthcare Providers Can Respond Quickly and Safely During the COVID-19 Peacetime Emergency,government,other,,CE75,https://mn.gov/governor/news/executiveorders.jsp#/list/appId/1/filterType//filterValue//page/4/sort//order/
Minnesota,,4/8/2020,"Extending Stay at Home Order and Temporary Closure of Bars, Restaurants, and Other Places of Public Accommodation",government,stay at home,,CE75,https://mn.gov/governor/news/executiveorders.jsp#/list/appId/1/filterType//filterValue//page/4/sort//order/
Mississippi,,3/12/2020,"National Collegiate Athletic Association cancelled all winter and spring tournaments, most notably the Division I men's and women's basketball tournaments, affecting colleges and universities statewide",other,events cancellation,,MT27,https://www.sunherald.com/news/coronavirus/article241951341.html
Mississippi,,3/14/2020,Gov. Tate Reeves declared a state of emergency,government,state of emergency,,LH16,https://www.livescience.com/mississippi-coronavirus.html
Mississippi,,3/14/2020,"Governor Tate Reeves, declared a state of emergency",government,state of emergency,,MT27,https://www.sunherald.com/news/coronavirus/article241951341.html
Mississippi,Jackson,3/15/2020,Jackson's city mayor Chokwe Antar Lumumba declared civil emergency for the city,government,state of emergency,,MT27,https://www.sunherald.com/news/coronavirus/article241951341.html
Mississippi,,3/16/2020,The Governor signed two executive orders which: Require agencies to keep essential employees and send non-essential employees home;Requests schools develop distance learning protocols,government,work restriction,,LH16,https://www.nga.org/coronavirus/
Mississippi,,3/19/2020,: Local governmental entities and school districts; authorize grant of admin leave with pay in event of certain disasters or emergencies,government,new public services,,MT27,https://www.sunherald.com/news/coronavirus/article241951341.html
Mississippi,,3/19/2020, The Governor announced the closing of all public schools through April 17 as well as end-of-year tests and accountability measures.,government,school closing,,LH16,https://www.nga.org/coronavirus/
Mississippi,Tupelo,3/21/2020,"the mayor of Tupelo, Jason Shelton, imposed a stay-at-home order that went into effect early on March 22",government,stay at home,,MT27,https://www.sunherald.com/news/coronavirus/article241951341.html
Mississippi,,3/21/2020,The Governor signed Executive Order 1462 that gives the Mississippi Department of Employment Security the ability to expedite payments to unemployed Mississippians and relax collection requirements on employers.,government,other,,LH16,https://www.nga.org/coronavirus/
Mississippi,Columbus,3/21/2020,Curfew implemented from 10 pm to 6 am,government,stay-at-home,,OJ98, https://www.wtva.com/content/news/columbus-curfew-568998021.html/
Mississippi,,3/23/2020,"The Governor announced that he is not currently ordering businesses to close, or for individuals to stay home.",government,work restriction,,LH16,https://www.nga.org/coronavirus/
Mississippi,,3/23/2020,The Centers for Medicare & Medicaid Services (CMS) approved Mississippi’s request for a Section 1135 Medicaid waiver. ,government,other,,LH16,https://www.nga.org/coronavirus/
Mississippi,,3/24/2020,"Gov. Reeves had issued an executive order and urged employees to work from home ""to the extent feasible,"" Business Insider reported.",government,stay at home,,LH16,https://www.livescience.com/mississippi-coronavirus.html
Mississippi,,3/24/2020,"Governor Reeves issued an executive order deeming most businesses as ""essential"" including restaurants, bars and other establishments including dining in but limiting to 10 persons",government,other,,MT27,https://www.sunherald.com/news/coronavirus/article241951341.html
Mississippi,,3/26/2020,Gov. Reeves allows local governments to impart stricter restrictions,government,other,,OJ98,https://www.picayuneitem.com/2020/03/local-business-restrictions-to-prevent-the-spread-of-covid-19-remain-in-place/
Mississippi,,3/30/2020,The Mississippi Department of Human Services increased the maximum SNAP benefit levels for families impacted by COVID-19. ,government,other,,LH16,https://www.nga.org/coronavirus/
Mississippi,,3/31/2020,The Governor issued a shelter in place order for a county in the state due to increased cases in that region.,government,other,,LH16,https://www.nga.org/coronavirus/
Mississippi,,4/1/2020,Gov. Tate Reeves issued a statewide stay at home order beginning April 3 at 5 p.m. through April 20 at 8 a.m.,government,stay at home,,LH16,https://www.livescience.com/mississippi-coronavirus.html
Mississippi,,4/9/2020," The Governor issued a statewide burn ban, due to requests from the Mississippi Forestry Commission, which would ease the strain on emergency responders who are responding to the public health emergency.",government,other,,LH16,https://www.nga.org/coronavirus/
Mississippi,,4/10/2020,The Governor signed an Executive Order restricting all non-essential elective surgeries and medical procedures.,government,other,,LH16,https://www.nga.org/coronavirus/
Mississippi,,4/10/2020,The Governor signed an Executive Order which creates additional protections from civil liability for healthcare workers and facilities assisting outside their normal operations in response to this public health emergency.,government,other,,LH16,https://www.nga.org/coronavirus/
Mississippi,,4/14/2020,The Governor announced that schools in Mississippi will remain closed for the rest of the school year.,government,school closing,,LH16,https://www.nga.org/coronavirus/
Mississippi,,4/15/2020,The Governor announced two new programs that aim to help those at risk of losing their homes and to provide essential workers access to childcare.,government,other,,LH16,https://www.nga.org/coronavirus/
Missouri,St. Louis,3/7/2020,First case reported,Government,,First case reported. Woman had returned from Italy.,PR48,https://www.ksdk.com/article/news/health/coronavirus/coronavirus-timeline-missouri/63-98439849-3152-4f54-80d0-43fe6f50f01e
Missouri,St. Louis,3/12/2020,Banned gatherings of 1000 or more,Government,Stay at home,Gatherings of 1000 or more banned to limit spread,PR 48,https://www.ksdk.com/article/news/health/coronavirus/coronavirus-timeline-missouri/63-98439849-3152-4f54-80d0-43fe6f50f01e
Missouri,St. Louis,3/12/2020,Second case reported,Government,,"Second ""presumptive postive"" case. Occurred 5 days later",PR48,https://www.ksdk.com/article/news/health/coronavirus/coronavirus-timeline-missouri/63-98439849-3152-4f54-80d0-43fe6f50f01e
Missouri,,3/13/2020,"On the morning of Friday, March 13, St. Louis County Executive Sam Page signed an executive order banning gatherings of more than 250 people.",government,events cancelled,,RM48,https://www.ksdk.com/article/news/health/coronavirus/coronavirus-timeline-missouri/63-98439849-3152-4f54-80d0-43fe6f50f01e
Missouri,,3/13/2020,"Parson declares a state of emergency, the same day as a national emergency is declared by the president.",government,state of emergency,,wt15,https://themissouritimes.com/missouris-response-to-coronavirus-a-timeline/
Missouri,,3/14/2020,"On March 14, Mercy opened a drive-thru testing facility, the first in the area. They tested 52 people in eight hours.",government,new public services,,RM48,https://www.ksdk.com/article/news/health/coronavirus/coronavirus-timeline-missouri/63-98439849-3152-4f54-80d0-43fe6f50f01e
Missouri,,3/15/2020,"Leaders in St. Louis, St. Louis County and St. Charles County made joint orders limiting gatherings to 50 people.",government,events cancelled,,RM48,https://www.ksdk.com/article/news/health/coronavirus/coronavirus-timeline-missouri/63-98439849-3152-4f54-80d0-43fe6f50f01e
Missouri,,3/16/2020,The Missouri Supreme Court suspends in-person proceedings in appellate circuit courts.,government,non-essential closing,,RM48,https://themissouritimes.com/missouris-response-to-coronavirus-a-timeline/
Missouri,,3/17/2020,Bars and restaraunts would have to stop dine in services by 3/20,Government,Stay at home,,PR48,https://www.ksdk.com/article/news/health/coronavirus/coronavirus-timeline-missouri/63-98439849-3152-4f54-80d0-43fe6f50f01e
Missouri,St. Louis,3/17/2020,"St. Louis area leaders furthered restricted social interactions, announcing bars and restaurants would have to stop dine-in services starting Friday, March 20.",government,events cancelled,starting 20-Mar,RM48,https://www.ksdk.com/article/news/health/coronavirus/coronavirus-timeline-missouri/63-98439849-3152-4f54-80d0-43fe6f50f01e
Missouri,Boone,3/18/2020,"An individual in Boone County dies, the first coronavirus-related death in the state.",other,,,wt15,https://themissouritimes.com/missouris-response-to-coronavirus-a-timeline/
Missouri,,3/18/2020,Missouri casinos also close this day.,other,non-essential closing,,wt15,https://themissouritimes.com/missouris-response-to-coronavirus-a-timeline/
Missouri,St. Louis,3/18/2020,St. Louis and St. Louis County also limited gatherings to no more than 10 people.,government,stay at home,,RM48,https://themissouritimes.com/missouris-response-to-coronavirus-a-timeline/
Missouri,,3/18/2020,The governor suspends municipal elections originally scheduled for April.,government,events cancelled,,wt15,https://themissouritimes.com/missouris-response-to-coronavirus-a-timeline/
Missouri,,3/18/2020,The National Park Service announced that the Gateway Arch and the associated museum would be closed beginning March 18 until further notice.,government,non-essential closing,,RM48,https://en.wikipedia.org/wiki/2020_coronavirus_pandemic_in_Missouri
Missouri,,3/19/2020,all four campuses in the University of Missouri System are closing,other,school closing,,wt15,https://www.columbiamissourian.com/news/covid19/um-campuses-to-shut-down-through-april-12/article_6ffc5e26-6a18-11ea-9e56-2fc943be6001.html
Missouri,,3/19/2020,Parson signs an executive order allowing executive agencies to waive or suspend some regulations while dealing with COVID-19.,government,new public services,,RM48,https://themissouritimes.com/missouris-response-to-coronavirus-a-timeline/
Missouri,,3/19/2020,"The Missouri Department of Elementary and Secondary Education announced that by 1:30 p.m. CDT on March 19, all 555 school districts in Missouri reported some form of district-wide school closures.",government,school closing,,RM48,https://en.wikipedia.org/wiki/2020_coronavirus_pandemic_in_Missouri
Missouri,,3/21/2020,No dining in at restaraunts,Government,other,,PR48,https://khqa.com/news/coronavirus/in-missouri-no-dining-in-at-restaurants-groups-of-10-or-more-banned-amid-coronavirus
Missouri,,3/21/2020,"Parson directs the Department of Health and Senior Services to require social distancing, instructing individuals to avoid gatherings of more than 10.",government,movement restriction,,RM48,https://themissouritimes.com/missouris-response-to-coronavirus-a-timeline/
Missouri,,3/21/2020,"St. Louis and St. Louis County each issued stay-at-home orders, asking people to stay in their homes with a few exceptions.",government,stay at home,,RM48,https://www.ksdk.com/article/news/health/coronavirus/coronavirus-timeline-missouri/63-98439849-3152-4f54-80d0-43fe6f50f01e
Missouri,,3/23/2020,Doctors no longer needed to connect a patient to a known coronavirus patient before allowing them to get tested.,government,new public services,,RM48,https://themissouritimes.com/missouris-response-to-coronavirus-a-timeline/
Missouri,"Columbia, Boone",3/24/2020,"Columbia and Boone County will be under a stay-at-home order as of 8 a.m. Wednesday through 8 a.m. April 24, city leaders announced Tuesday morning",government,stay at home,,wt15,https://www.columbiamissourian.com/news/covid19/stay-at-home-order-begins-wednesday-public-schools-wont-reopen-until-april-27/article_a13705da-6dd4-11ea-89d2-2bd6859c3738.html
Missouri,,3/24/2020,Parson also requests a federal disaster declaration.,government,state of emergency,,wt15,https://themissouritimes.com/missouris-response-to-coronavirus-a-timeline/
Missouri,,3/24/2020,"The Missouri Capitol and state offices officially close. About 15,000 state employees are already working from home by this point",government,,,wt15,https://themissouritimes.com/missouris-response-to-coronavirus-a-timeline/
Missouri,,3/25/2020,Mayor Parson requests disaster declaration from President,Government,,,PR48,https://www.ksdk.com/article/news/health/coronavirus/coronavirus-timeline-missouri/63-98439849-3152-4f54-80d0-43fe6f50f01e
Missouri,,3/27/2020,Parson mobilizes the Missouri National Guard to assist with coronavirus response efforts.,government,,,wt15,https://themissouritimes.com/missouris-response-to-coronavirus-a-timeline/
Missouri,,3/30/2020,"During his daily coronavirus response briefing, Gov. Mike Parson said he does not plan to implement a statewide stay-at-home order.",government,stay at home,,RM48,https://www.ksdk.com/article/news/health/coronavirus/coronavirus-timeline-missouri/63-98439849-3152-4f54-80d0-43fe6f50f01e
Missouri,,3/30/2020,"The number of coronavirus cases in Missouri surpassed 1,000 Monday, and St. Louis County accounts for 33% of them.",government,,record,RM48,https://www.ksdk.com/article/news/health/coronavirus/coronavirus-timeline-missouri/63-98439849-3152-4f54-80d0-43fe6f50f01e
Missouri,,4/2/2020,A handful of Missouri State Parks closes to the public this evening after days of complaints several individuals were not practicing social distancing.,government,,,wt15,https://themissouritimes.com/missouris-response-to-coronavirus-a-timeline/
Missouri,,4/2/2020,"Parson signs an executive order waiving late fees on concealed carry permit renewals, something he says will free up local law enforcement officials from administrative tasks.",government,new public services,,RM48,https://themissouritimes.com/missouris-response-to-coronavirus-a-timeline/
Missouri,St. Louis,4/4/2020,St. Louis County is backing the White House and CDC recommendation that Americans should wear a mask in public. Officials say the change can help slow the spread of the coronavirus.,government,wear masks,,RM48,https://www.kmov.com/news/st-louis-county-officials-urge-everyone-to-wear-masks-in-public-to-limit-spread-of/article_ded5901e-76c6-11ea-a0e2-c3586b16d7bd.html
Missouri,,4/7/2020,Parson and Labor Director Anna Hui announce Missouri will implement an emergency rule to ensure first responders who contract coronavirus will be covered under the state’s workers’ compensation law.,government,new public services,,RM48,https://themissouritimes.com/missouris-response-to-coronavirus-a-timeline/
Missouri,,4/7/2020,Parson announces Missouri will be under a statewide stay at home order,government,,,wt15,https://themissouritimes.com/missouris-response-to-coronavirus-a-timeline/
Missouri,,4/9/2020,"Parson announces schools will remain closed for the remainder of the year, with remote learning to continue through the end of the scheduled school year.",government,school closing,until end of school year,RM48,https://themissouritimes.com/missouris-response-to-coronavirus-a-timeline/
Missouri,,4/10/2020,"Missouri is now recording 3,799 cases of COVID-19 in the state as of Friday afternoon",other,,,wt15,http://www.dailystarjournal.com/coronavirus/covid-19-timeline/article_6503c55a-2e14-59b5-b673-99e308729e48.html
Missouri,,4/12/2020,113 new cases on Easter Sunday,other,,"4,160 cases of COVID-19 and 110 deaths have been reported.",PR48,https://www.kmbc.com/article/missouri-136-new-coronavirus-cases-identified-easter-sunday/32120373#
Montana,,3/3/2020,Governor Bullock activated the Governors’ Coronavirus Task Force to coordinate efforts across state government responding to COVID-19,government,new public services,,MA35,https://www.nga.org/coronavirus/
Montana,Montana State University,3/9/2020,Montana State University cancels international trips,other,movement restriction,,AK13 (KA31 on Google Spreadsheet),https://www.montana.edu/health/coronavirus/archived-comms.html
Montana,Montana State University,3/9/2020,Montana State University cancels National Conference on Undergraduate Research,other,events cancelled,,AK13 (KA31 on Google Spreadsheet),https://www.montana.edu/health/coronavirus/archived-comms.html
Montana,Montana State University,3/12/2020,Montana State University announces in-person learning will be moved to online format starting 3/23,other,school closing,,AK13 (KA31 on Google Spreadsheet),https://www.montana.edu/health/coronavirus/archived-comms.html
Montana,,3/12/2020,state of emergency declaration,government,state of emergency,,ma35,https://www.mtpr.org/post/montana-gov-declares-state-emergency-over-coronavirus
Montana,Billings,3/13/2020,Library system closes and all due dates extended until May 1,government,non-essential closing,,ma35,https://billingslibrary.org/465/COVID-19-Info-Resources
Montana,,3/15/2020,public school closing,government,school closing,,ma35,https://www.arcgis.com/apps/MapSeries/index.html?appid=7c34f3412536439491adcc2103421d4b
Montana,,3/16/2020,The Governor activated eight Montana Army National Guard soldiers to assist in the arrival and transport of Montana residents returning from quarantine.,government,new public services,,MA35,https://www.nga.org/coronavirus/
Montana,Helena,3/16/2020,10 day state of emergency announced by Mayor Wilmot Collins,government,state of emergency,local government,OJ98,https://www.kxlh.com/news/coronavirus/city-of-helena-declares-state-of-emergency
Montana,Gallatin,3/16/2020,Health officials restrict food service and close bars in Gallatin County,government,non-essential closing,,AK13 (KA31 on Google Spreadsheet),https://www.nga.org/coronavirus/
Montana,,3/17/2020,uninsured residents who receive a recommendation from their provider will be eligible to receive coverage for COVID-19 testing and treatment.,government,new public services,,MA35,https://www.nga.org/coronavirus/
Montana,,3/17/2020,"emergency rules to make unemployment benefits accessible to workers who have been laid off due to COVID-19, while also waiving the waiting period for receiving benefits.",government,new public services,,MA35,https://www.nga.org/coronavirus/
Montana,,3/18/2020,The Governor expanded access to telemedicine services to ensure Montana Medicaid patients receive quality health care in their homes to prevent unnecessary gatherings at health care facilities.,government,movement restriction,,MA35,https://www.nga.org/coronavirus/
Montana,,3/19/2020,quarantine advisory of 14 days to all residents who have traveled internationally.,government,movement restriction,,MA35,https://www.nga.org/coronavirus/
Montana,,3/20/2020,directive to close non-essential business,government,non-essential closing,,ma35,https://www.arcgis.com/apps/MapSeries/index.html?appid=7c34f3412536439491adcc2103421d4b
Montana,Billings,3/21/2020,Billings police implement new policies including not arresting people who are not a danger to the community,government,public service reduction,,ma35,https://www.kulr8.com/top_story/billings-police-department-makes-changes-in-response-to-covid-19/article_d21653e2-6b7a-11ea-8cde-d3a81e3d9907.html
Montana,,3/23/2020,Directice to provide measures to ease procurement of medical supplies and ease the transfer of patients,government,other,,OJ98,"http://governor.mt.gov/Portals/16/Directive%20on%20Hospital%20Surge%20Capacity.pdf?ver=2020-03-23-202741-340
"
Montana,,3/24/2020,city and local governments given flexibility in following operating hour and staffing requirements to encourage social distancing,government,non-essential closing,,ma35,https://www.arcgis.com/apps/MapSeries/index.html?appid=7c34f3412536439491adcc2103421d4b
Montana,,3/24/2020,all local county ordinances are preempted by state directives in the case that the local policies are less restrictive,government,other,local government preempted,ma35,https://www.arcgis.com/apps/MapSeries/index.html?appid=7c34f3412536439491adcc2103421d4b
Montana,,3/25/2020,Directive to allo counties the choice of implementing mail in ballots for the general election,government,new public services,,OJ98,"https://covid19.mt.gov/Portals/223/Documents/Directive%20on%20Elections.pdf?ver=
"
Montana,,3/26/2020,stay at home order,government,stay at home,,ma35,https://www.arcgis.com/apps/MapSeries/index.html?appid=7c34f3412536439491adcc2103421d4b
Montana,,3/27/2020,temporary lifted certain commercial motor carrier vehicle requirements,government,public service reduction,,ma35,https://www.arcgis.com/apps/MapSeries/index.html?appid=7c34f3412536439491adcc2103421d4b
Montana,,3/30/2020,all travelers entering MT for non-essential reasons must self-quarantine for 14 days,government,movement restriction,,ma35,https://www.arcgis.com/apps/MapSeries/index.html?appid=7c34f3412536439491adcc2103421d4b
